{
  "iss": "did:opena2a:authority:opena2a.org",
  "sub": "did:opena2a:agent:acme/orders-reader",
  "bac_level": 3,
  "atx_reference": "sha256:2052879dda15b1ca5e60319e3477a4008412bffdaf3c3566c658795a48cab8fd",
  "binary_hash": "sha256:479bd28a55e3a3eb20b9f5b48202318d5de9d0dbea9e6df20b2ee7ff95a4c135",
  "drift_score": 0.04,
  "anomaly_state": "nominal",
  "intent_verified": true,
  "session_label": [
    "internal"
  ],
  "iat": 1780315200,
  "exp": 1780315260,
  "jti": "e5f6a7b8c9d0123c4d5e6f7081920314"
}
